object_id	accession	analytical_unit	file_name	md5	status	notes
GSE157827_stepH	GSE157827	AD_MFG	stepH_obj_celltype6_named.rds	NA	not_archived_reproducible_from_public_raw_data	Generated by code/01_per_dataset/GSE157827 from public GEO raw counts; not planned for Zenodo because it is a reproducible intermediate object.
GSE174367_stepH	GSE174367	AD_PFC	stepH_obj_celltype6_named.rds	NA	not_archived_reproducible_from_public_raw_data	Generated by code/01_per_dataset/GSE174367 from public GEO raw counts; not planned for Zenodo because it is a reproducible intermediate object.
syn21788402_EC_stepH	syn21788402	AD_EC	stepH_syn21788402_EC_obj_labeled_celltype7_celltype6.rds	5b886962e4c483e507dd571c93c45f3c	not_archived_reproducible_from_public_author_sce	Generated by code/01_per_dataset/syn21788402 from author-provided public SCE; descriptive n=3 vs 3 analytical unit; not planned for Zenodo.
syn21788402_SFG_stepH	syn21788402	AD_SFG	stepH_syn21788402_SFG_obj_celltype6.rds	8eba6245c8bf5c26b08be5f9a2f47ee7	not_archived_reproducible_from_public_author_sce	Generated by code/01_per_dataset/syn21788402 from author-provided public SCE; descriptive n=3 vs 3 analytical unit; not planned for Zenodo.
syn52082747_stepH	syn52082747	AD_PSP_FTD_V1	stepH_slim_uncompressed.rds	3f8c89bd11b467bf3c9f3de78362817f	not_archived_reproducible_from_public_author_object	Generated by code/01_per_dataset/syn52082747 from author-provided public processed object; local reproduction was byte-identical to the historical manuscript object; 590541 cells and 30309 genes; not planned for Zenodo.
